{
  "schema": "dsh-forge.catalog-feed/v1",
  "generated_at": "2026-09-05T21:30:00Z",
  "source_schema": "dsh-forge.catalog-sources/v1",
  "signature_status": "unsigned_development_seed",
  "packages": [
    {
      "schema": "dsh-forge.catalog-package/v1",
      "id": "catalog-package:agent-teams-builder",
      "slug": "agent-teams-builder",
      "name": "AgentTeams Builder",
      "summary": "A pinned AgentTeams package candidate for using persistent, dependency-aware DeepSeek Harness teams to help build and review DSH Forge.",
      "kind": "single_plugin",
      "rank": 1,
      "featured": true,
      "publisher": {
        "id": "dsh-forge-curation",
        "name": "DSH Forge curation",
        "kind": "curator"
      },
      "components": [
        {
          "artifact_id": "github:1332073142",
          "role": "Captain-led persistent agent teams, task DAGs, direct messaging, quality gates, and live Web inspection.",
          "package": {
            "registry": "npm",
            "name": "@nanmicoder/dsh-agent-teams",
            "version": "0.1.16-rc.1",
            "integrity": "sha512-gHrlUXuFnqz4wBw55v3ury/0PhNNCZ8/1eYycXUWGUgz97sxMzOMOLGGtpBijQ2/TzOqgRkv43+i/zKFU5GIZQ==",
            "url": "https://www.npmjs.com/package/@nanmicoder/dsh-agent-teams/v/0.1.16-rc.1"
          },
          "repository": {
            "full_name": "NanmiCoder/dsh-agent-teams",
            "url": "https://github.com/NanmiCoder/dsh-agent-teams",
            "commit": "1caff61f4c0909711b515ebc56187055556186cd"
          },
          "compatibility": "Node ^22.19 or >=24; Web and headless support are declared. The existing 0.1.2-alpha.3 Delta tree is not in the plugin's supported host list."
        }
      ],
      "taxonomy": [
        "multi-agent orchestration",
        "collaboration",
        "persistent tasks",
        "quality gates"
      ],
      "compatibility": {
        "status": "declared",
        "harness_versions": [
          "0.1.2-rc.1",
          "0.1.2-alpha.5",
          "0.1.2-alpha.2"
        ],
        "node": "^22.19.0 || >=24",
        "surfaces": [
          "web",
          "headless"
        ],
        "summary": "The publisher declares these exact host versions. Forge has not yet reproduced the matrix; alpha.3 is deliberately excluded."
      },
      "license": {
        "status": "reported",
        "expressions": [
          "MIT"
        ]
      },
      "risk": {
        "level": "high",
        "permissions": [
          "subagent creation",
          "workspace writes",
          "persistent state",
          "model calls"
        ],
        "notes": "Parallel delegated agents amplify filesystem, model-cost, and prompt-injection risk. Test only in a disposable Apptainer profile before promotion."
      },
      "provenance": {
        "directory_ids": [
          "dsh-get",
          "awesome-dsh",
          "npm",
          "github"
        ],
        "authoritative_sources": [
          "https://github.com/NanmiCoder/dsh-agent-teams/tree/1caff61f4c0909711b515ebc56187055556186cd",
          "https://github.com/deepseek-ai/deepseek-harness/discussions/1785",
          "https://www.npmjs.com/package/@nanmicoder/dsh-agent-teams/v/0.1.16-rc.1"
        ],
        "claims_verified": false
      },
      "verification": {
        "metadata_reviewed": true,
        "artifacts_acquired": false,
        "installed": false,
        "executed": false,
        "sandbox_verified": false
      },
      "acquisition": {
        "enabled": false,
        "label": "Acquire verified bytes",
        "status": "requires_signed_dsse",
        "reason": "No trusted DSSE envelope is published for this catalog recipe; installation and execution are not authorized."
      },
      "page": {
        "route": "#packages/agent-teams-builder"
      },
      "updated_at": "2026-09-05T21:30:00Z"
    },
    {
      "schema": "dsh-forge.catalog-package/v1",
      "id": "catalog-package:code-review-lab",
      "slug": "code-review-lab",
      "name": "Code Review Lab",
      "summary": "A static-review candidate combining pre-install plugin auditing with a repository symbol index and bounded code maps.",
      "kind": "plugin_stack",
      "rank": 2,
      "featured": true,
      "publisher": {
        "id": "dsh-forge-curation",
        "name": "DSH Forge curation",
        "kind": "curator"
      },
      "components": [
        {
          "artifact_id": "github:1350484605",
          "role": "Audit plugin metadata and supply-chain indicators before any install boundary.",
          "package": {
            "registry": "npm",
            "name": "dsh-vet",
            "version": "0.3.0",
            "integrity": "sha512-HdQoj+ZxoYJRp3/PUK7fIIc/bj6FhyF86SDxyKapRQB1X23GY9hPM7PNoarzAvSa7k4isv6nrnXR8S7IqfQ0Ig==",
            "url": "https://www.npmjs.com/package/dsh-vet/v/0.3.0"
          },
          "repository": {
            "full_name": "rogerdigital/dsh-vet",
            "url": "https://github.com/rogerdigital/dsh-vet",
            "commit": "01857c72998c7ac7ad5a7241d13a8847c024558e"
          },
          "compatibility": "Node >=20; manifest declares fs, shell, and web audit seams, but no exact Harness range."
        },
        {
          "artifact_id": "github:1341363840",
          "role": "Build a symbol index and bounded repository map for code review context.",
          "package": {
            "registry": "npm",
            "name": "dsh-code-index",
            "version": "0.3.1",
            "integrity": "sha512-rTCRRKrw/qJa7BQSE/CRV+I95KQnlgv35CDg1QHHu9cFEO6xH5ugLL4NDdcKoZH4x8fPxrITVIsXbe8rgUpWxg==",
            "url": "https://www.npmjs.com/package/dsh-code-index/v/0.3.1"
          },
          "repository": {
            "full_name": "lemonxiny55/dsh-code-index",
            "url": "https://github.com/lemonxiny55/dsh-code-index",
            "commit": "de81accbc5104fa2a872d692de7205b59d1e6130"
          },
          "compatibility": "Node >=22; Cordis ^4.0.1; release 0.3.1 updates web-tree-sitter to >=0.25 compatibility."
        }
      ],
      "taxonomy": [
        "code intelligence",
        "static audit",
        "supply-chain review",
        "repository mapping"
      ],
      "compatibility": {
        "status": "unknown",
        "harness_versions": [],
        "node": ">=22",
        "surfaces": [
          "web",
          "headless"
        ],
        "summary": "The components have not been tested together. dsh-code-index declares a broad pre-0.2 tools range; dsh-vet declares no exact Harness range."
      },
      "license": {
        "status": "reported",
        "expressions": [
          "MIT"
        ]
      },
      "risk": {
        "level": "medium-high",
        "permissions": [
          "repository reads",
          "recursive indexing",
          "archive parsing"
        ],
        "notes": "Review path confinement, symlink handling, malicious archive behavior, prompt injection through source text, and resource exhaustion."
      },
      "provenance": {
        "directory_ids": [
          "awesome-dsh",
          "show-your-plugins",
          "npm",
          "github"
        ],
        "authoritative_sources": [
          "https://github.com/deepseek-ai/deepseek-harness/discussions/5423",
          "https://github.com/deepseek-ai/deepseek-harness/discussions/5623",
          "https://github.com/lemonxiny55/dsh-code-index/tree/de81accbc5104fa2a872d692de7205b59d1e6130",
          "https://github.com/rogerdigital/dsh-vet/tree/01857c72998c7ac7ad5a7241d13a8847c024558e",
          "https://www.npmjs.com/package/dsh-code-index/v/0.3.1",
          "https://www.npmjs.com/package/dsh-vet/v/0.3.0"
        ],
        "claims_verified": false
      },
      "verification": {
        "metadata_reviewed": true,
        "artifacts_acquired": false,
        "installed": false,
        "executed": false,
        "sandbox_verified": false
      },
      "acquisition": {
        "enabled": false,
        "label": "Acquire verified bytes",
        "status": "requires_signed_dsse",
        "reason": "No trusted DSSE envelope is published for this catalog recipe; installation and execution are not authorized."
      },
      "page": {
        "route": "#packages/code-review-lab"
      },
      "updated_at": "2026-09-05T21:30:00Z"
    },
    {
      "schema": "dsh-forge.catalog-package/v1",
      "id": "catalog-package:auditable-memory-lab",
      "slug": "auditable-memory-lab",
      "name": "Auditable Memory Lab",
      "summary": "A local-first memory candidate pairing an append-only session evidence ledger with reviewed long-term rules and preferences.",
      "kind": "plugin_stack",
      "rank": 3,
      "featured": false,
      "publisher": {
        "id": "dsh-forge-curation",
        "name": "DSH Forge curation",
        "kind": "curator"
      },
      "components": [
        {
          "artifact_id": "github:1295914860",
          "role": "Retain immutable, queryable evidence from prior sessions.",
          "package": {
            "registry": "mcpb",
            "name": "rawmem",
            "version": "0.7.1",
            "integrity": "sha256-184b88f682bf27b7f06b4061f25972e572fbd3b22b147171a6c41dc9e6379266",
            "url": "https://github.com/Liyuan1992/rawmem/releases/tag/v0.7.1"
          },
          "repository": {
            "full_name": "Liyuan1992/rawmem",
            "url": "https://github.com/Liyuan1992/rawmem",
            "commit": "dd0cf91726b903835a1517652e92ec95b4134e68"
          },
          "compatibility": "Python >=3.10 MCP sidecar with a DSH example configuration; not a native npm/Cordis bundle."
        },
        {
          "artifact_id": "github:1289127532",
          "role": "Propose, review, and approve durable memory policy entries.",
          "package": {
            "registry": "mcpb",
            "name": "memdsl",
            "version": "0.9.2",